<?xml version="1.0" encoding="UTF-8"?>
<!--Sample XML file generated by XMLSpy v2012 rel. 2 sp1 (http://www.altova.com)-->
<!DOCTYPE cookbook SYSTEM "C:\Users\Lyness\Desktop\recipebook.dtd">
<cookbook>
	<title>Snacks on Snack on Snacks</title>
	<section>
		<title>Desserts</title>
		<recipe>
			<title>15 Minute Brownies</title>
			<recipeinfo>
				<author>sooz</author>
			</recipeinfo>
			<ingredientlist/>
			<preparation>
				<equipment>
					<hyperlink url="text">text</hyperlink>
				</equipment>
				<step>1. Combine flour, soda and salt; set aside.
					<equipment>mixing bowl
						<hyperlink url="text">text</hyperlink>
					</equipment>
					<hyperlink url="text">text</hyperlink>
				</step>
				<step> 2. In microwave-safe mixing bowl, combine butter, sugar and water. Cook for
  2 minutes at 100% power, stirring after 1 minute. Remove from oven.Add 1
  cup chocolate chips and vanilla and stir until smooth and chips are melted.
					<equipment>see previous
						<hyperlink url="text">text</hyperlink>
					</equipment>
					<hyperlink url="text">text</hyperlink>
				</step>
				<step>3. Add eggs, one at a time, beating after each addition. Blend in flour
  mixture and stir in remaining chocolate chips.
					<equipment>see previous
						<hyperlink url="text">text</hyperlink>
					</equipment>
					<hyperlink url="text">text</hyperlink>
				</step>
				<step>4. Pour into an 8 or 9 inch microwave-safe baking pan. Place a saucer,
  upside down, in the microwave and put baking pan on top of saucer.
					<equipment>baking pan; saucer
						<hyperlink url="text">text</hyperlink>
					</equipment>
					<hyperlink url="text">text</hyperlink>
				</step>
				<step> 5. Cook at 70% power for 10 minutes turning after 5 minutes. Enjoy!
					<equipment>
						<hyperlink url="text">text</hyperlink>
					</equipment>
					<hyperlink url="text">text</hyperlink>
				</step>
				<hyperlink url="text">text</hyperlink>
			</preparation>
			<notes>
				<hyperlink url="text">text</hyperlink>
			</notes>
		</recipe>
	</section>
</cookbook>
